[
  {
    "id": "fish_crucian_carp",
    "name": "鲫鱼",
    "alias": ["土鲫", "河鲫"],
    "gallery": [
      { "title": "体型识别", "subtitle": "体侧扁，背部偏暗，常见于湖库河道", "tone": "green" },
      { "title": "常见钓法", "subtitle": "台钓、传统钓、轻窝慢守", "tone": "blue" },
      { "title": "适口饵料", "subtitle": "蚯蚓、红虫、腥香拉饵、玉米粉窝", "tone": "amber" }
    ],
    "length": "常见 10-25cm，成鱼可超过 30cm",
    "weight": "常见 50-300g，优质水域可达 500g 以上",
    "habits": "适应性强，喜欢缓流、草边、浅滩和有遮蔽物的区域。清晨、傍晚和气温稳定时更容易开口。",
    "strategy": [
      "优先找水草边、缓坡和回湾。",
      "气温低时用小钩细线和腥味饵，气温高时可换清淡饵。",
      "窝量不要过猛，少量多次补窝更稳。"
    ],
    "season": "春秋最稳定，冬季也可细钓。",
    "risk_note": "小个体较多时注意放流，禁渔期和保护水域不要作钓。"
  },
  {
    "id": "fish_topmouth_culter",
    "name": "翘嘴",
    "alias": ["翘嘴鲌", "白鱼"],
    "gallery": [
      { "title": "水面窗口", "subtitle": "追小鱼时常在清晨和傍晚炸水", "tone": "blue" },
      { "title": "路亚标点", "subtitle": "桥墩、明暗交界、缓急流交界", "tone": "green" },
      { "title": "拟饵选择", "subtitle": "亮片、米诺、铅笔、小铁板", "tone": "amber" }
    ],
    "length": "常见 20-45cm，大个体可超过 60cm",
    "weight": "常见 200g-1kg，优质水域可达 2kg 以上",
    "habits": "中上层掠食鱼，喜欢追逐小鱼，风小、水面有活饵活动时更活跃。",
    "strategy": [
      "优先搜索水面有小鱼跳动的位置。",
      "傍晚可用亮片或米诺沿缓流边搜索。",
      "收线节奏不要过快，加入停顿更容易触发攻击。"
    ],
    "season": "夏秋活跃，清晨和傍晚窗口明显。",
    "risk_note": "临江临湖抛投注意身后空间和岸线防滑。"
  },
  {
    "id": "fish_bream",
    "name": "鳊鱼",
    "alias": ["武昌鱼"],
    "gallery": [
      { "title": "鱼体特征", "subtitle": "体高侧扁，喜欢中下层活动", "tone": "green" },
      { "title": "适合水域", "subtitle": "湖泊、水库、缓流河湾", "tone": "blue" },
      { "title": "作钓思路", "subtitle": "轻窝慢诱，玉米和植物性饵常有效", "tone": "amber" }
    ],
    "length": "常见 18-35cm",
    "weight": "常见 150g-800g",
    "habits": "偏植食和杂食，喜欢水草、缓流和水质较稳定区域。",
    "strategy": [
      "选择水草边、缓坡和离岸稍远的平台。",
      "玉米、颗粒和清香饵更适合温暖季节。",
      "钓组保持灵敏，口轻时减少饵团大小。"
    ],
    "season": "春末到秋季较稳定。",
    "risk_note": "注意区分保护水域和养殖水域规则。"
  },
  {
    "id": "fish_mandarin",
    "name": "鳜鱼",
    "alias": ["桂鱼"],
    "gallery": [
      { "title": "伏击习性", "subtitle": "偏爱石缝、障碍和暗处", "tone": "green" },
      { "title": "标点判断", "subtitle": "桥墩、乱石、沉木、水闸边", "tone": "blue" },
      { "title": "路亚攻略", "subtitle": "软虫、VIB、小米诺贴底搜索", "tone": "amber" }
    ],
    "length": "常见 20-40cm，大个体可超过 50cm",
    "weight": "常见 300g-1.5kg",
    "habits": "典型伏击型掠食鱼，喜欢有结构的水域，常在弱光或水流变化处捕食。",
    "strategy": [
      "先找乱石、桥墩和深浅交界。",
      "软虫贴底慢跳，注意停顿时的轻口。",
      "中鱼后尽快控鱼，避免钻障碍。"
    ],
    "season": "晚春到秋季较活跃。",
    "risk_note": "结构区挂底多，注意安全站位和装备回收。"
  },
  {
    "id": "fish_carp",
    "name": "鲤鱼",
    "alias": ["鲤拐子"],
    "gallery": [
      { "title": "底层活动", "subtitle": "常在泥底、缓坡和水草边觅食", "tone": "green" },
      { "title": "饵料选择", "subtitle": "玉米、颗粒、薯香、谷物窝料", "tone": "amber" },
      { "title": "控鱼重点", "subtitle": "中鱼后冲劲大，注意泄力和岸线空间", "tone": "blue" }
    ],
    "length": "常见 25-60cm",
    "weight": "常见 0.5-3kg，水库大个体可更重",
    "habits": "底层杂食鱼，警惕性较高，喜欢安静、食物沉积和水温稳定的位置。",
    "strategy": [
      "提前打窝，减少频繁抛投干扰。",
      "选择缓坡、入水口附近或水草边。",
      "线组和钩号要留有余量，避免跑鱼。"
    ],
    "season": "春末、夏季和秋季较活跃。",
    "risk_note": "大鱼遛鱼时间长，夜钓注意照明和防滑。"
  },
  {
    "id": "fish_grass_carp",
    "name": "草鱼",
    "alias": ["草青"],
    "gallery": [
      { "title": "草食偏好", "subtitle": "偏爱水草、嫩草和植物性饵料", "tone": "green" },
      { "title": "高温活跃", "subtitle": "夏季清晨和傍晚更容易开口", "tone": "blue" },
      { "title": "大鱼策略", "subtitle": "钓组留余量，控鱼别急拉硬拽", "tone": "amber" }
    ],
    "length": "常见 35-80cm",
    "weight": "常见 1-5kg，养殖或大水面可更重",
    "habits": "中下层活动，偏植物性食物，温暖季节摄食旺盛。",
    "strategy": [
      "选择水草边、浅滩和安静湾口。",
      "玉米、嫩草、颗粒和发酵饵都可尝试。",
      "中大鱼后保持竿角，耐心消耗体力。"
    ],
    "season": "夏秋更活跃。",
    "risk_note": "大个体力量强，抄网和岸边站位要提前准备。"
  }
]
